keyword,definition,category,filename,status_en,status_ja
WhatsApp Business,Business messaging through WhatsApp.,Omnichannel Support,WhatsApp-Business.md,completed,completed
WhatsApp Integration,Connecting WhatsApp to support systems.,Omnichannel Support,WhatsApp-Integration.md,completed,completed
Agent Framework,Infrastructure for building AI agents.,Platform Ecosystems & Integrations,Agent-Framework.md,completed,completed
API Management,Tools for designing and monitoring APIs.,Platform Ecosystems & Integrations,API-Management.md,completed,completed
API Rate Limiting,Restricting API call frequency.,Platform Ecosystems & Integrations,API-Rate-Limiting.md,completed,completed
App Marketplace,Platform for discovering integrations.,Platform Ecosystems & Integrations,App-Marketplace.md,completed,completed
Channel Connector,Integration connecting communication channel.,Platform Ecosystems & Integrations,Channel-Connector.md,completed,completed
Connector,Pre-built integration between systems.,Platform Ecosystems & Integrations,Connector.md,completed,completed
Custom Integration,Tailored connection between specific systems.,Platform Ecosystems & Integrations,Custom-Integration.md,completed,completed
Data Connector,Integration for moving data between systems.,Platform Ecosystems & Integrations,Data-Connector.md,completed,completed
Ecosystem Integration,Connecting across platform ecosystems.,Platform Ecosystems & Integrations,Ecosystem-Integration.md,completed,completed
Event-Driven Architecture,Systems communicating through events.,Platform Ecosystems & Integrations,Event-Driven-Architecture.md,completed,completed
Integration Patterns,Common approaches for connecting systems.,Platform Ecosystems & Integrations,Integration-Patterns.md,completed,completed
Integration Platform as a Service (iPaaS),Cloud platform for building integrations.,Platform Ecosystems & Integrations,Integration-Platform-as-a-Service--iPaaS-.md,completed,completed
LangChain,Framework for building LLM applications.,Platform Ecosystems & Integrations,LangChain.md,completed,completed
Low-Code/No-Code,Building applications with minimal coding.,Platform Ecosystems & Integrations,Low-Code-No-Code.md,completed,completed
Message Queue,System for asynchronous communication.,Platform Ecosystems & Integrations,Message-Queue.md,completed,completed
MCP (Model Context Protocol),Protocol for AI model communication.,Platform Ecosystems & Integrations,MCP--Model-Context-Protocol-.md,completed,completed
Native Integration,Built-in connections between platforms.,Platform Ecosystems & Integrations,Native-Integration.md,completed,completed
Partner Ecosystem,Network of complementary solution providers.,Platform Ecosystems & Integrations,Partner-Ecosystem.md,completed,completed
Platform API,Interface for extending platform capabilities.,Platform Ecosystems & Integrations,Platform-API.md,completed,completed
Platform Extensibility,Ability to customize and extend platform.,Platform Ecosystems & Integrations,Platform-Extensibility.md,completed,completed
Plugin Architecture,System allowing modular extensions.,Platform Ecosystems & Integrations,Plugin-Architecture.md,completed,completed
Pre-Built Connector,Ready-made integration for common systems.,Platform Ecosystems & Integrations,Pre-Built-Connector.md,completed,completed
Service Bus,Middleware enabling service communication.,Platform Ecosystems & Integrations,Service-Bus.md,completed,completed
System of Record,Authoritative source for specific data.,Platform Ecosystems & Integrations,System-of-Record.md,completed,completed
Third-Party Integration,Connecting external applications.,Platform Ecosystems & Integrations,Third-Party-Integration.md,completed,completed
Unified API,Single interface for multiple services.,Platform Ecosystems & Integrations,Unified-API.md,completed,completed
Acceptance Criteria,Conditions for considering work complete.,Product Management & Agile,Acceptance-Criteria.md,completed,completed
Agile Development,Iterative approach to software development.,Product Management & Agile,Agile-Development.md,completed,completed
Backlog Grooming,Refining and prioritizing product backlog.,Product Management & Agile,Backlog-Grooming.md,completed,completed
Burndown Chart,Graph showing work remaining over time.,Product Management & Agile,Burndown-Chart.md,completed,completed
Definition of Done,Criteria for completed work items.,Product Management & Agile,Definition-of-Done.md,completed,completed
DevOps,Practices unifying development and operations.,Product Management & Agile,DevOps.md,completed,completed
Feature Flag Management,Controlling feature releases dynamically.,Product Management & Agile,Feature-Flag-Management.md,completed,completed
Feature Prioritization,Ranking features by importance and value.,Product Management & Agile,Feature-Prioritization.md,completed,completed
Feature Request,Customer or stakeholder suggestion for product.,Product Management & Agile,Feature-Request.md,completed,completed
Kanban Board,Visual workflow management tool.,Product Management & Agile,Kanban-Board.md,completed,completed
Minimum Viable Product (MVP),Simplest product version for testing ideas.,Product Management & Agile,Minimum-Viable-Product--MVP-.md,completed,completed
Product Backlog,Prioritized list of product features and fixes.,Product Management & Agile,Product-Backlog.md,completed,completed
Product Discovery,Research phase for understanding user needs.,Product Management & Agile,Product-Discovery.md,completed,completed
Product Feedback Loop,Continuous cycle of user input and improvement.,Product Management & Agile,Product-Feedback-Loop.md,completed,completed
Product-Market Fit,Product satisfying strong market demand.,Product Management & Agile,Product-Market-Fit.md,completed,completed
Product Roadmap,Strategic plan for product development.,Product Management & Agile,Product-Roadmap.md,completed,completed
Release Management,Coordinating software releases.,Product Management & Agile,Release-Management.md,completed,completed
Scrum,Agile framework for iterative development.,Product Management & Agile,Scrum.md,completed,completed
Sprint Planning,Selecting work for upcoming iteration.,Product Management & Agile,Sprint-Planning.md,completed,completed
Sprint Retrospective,Team reflection on recent work cycle.,Product Management & Agile,Sprint-Retrospective.md,completed,completed
Stakeholder Management,Managing relationships with key parties.,Product Management & Agile,Stakeholder-Management.md,completed,completed
Technical Specification,Detailed technical requirements document.,Product Management & Agile,Technical-Specification.md,completed,completed
User Acceptance Testing (UAT),End users validating software before release.,Product Management & Agile,User-Acceptance-Testing--UAT-.md,completed,completed
User Story,Feature description from user perspective.,Product Management & Agile,User-Story.md,completed,completed
Velocity (Agile),Team's rate of completing work.,Product Management & Agile,Velocity--Agile-.md,completed,completed
Deal Velocity,Speed at which sales opportunities progress.,Revenue Operations (RevOps),Deal-Velocity.md,completed,completed
Forecasting Accuracy,Precision of sales predictions.,Revenue Operations (RevOps),Forecasting-Accuracy.md,completed,completed
Pipeline Coverage,Ratio of pipeline value to quota.,Revenue Operations (RevOps),Pipeline-Coverage.md,completed,completed
Revenue Attribution,Linking revenue to marketing activities.,Revenue Operations (RevOps),Revenue-Attribution.md,completed,completed
Revenue Funnel,Stages from prospect to customer.,Revenue Operations (RevOps),Revenue-Funnel.md,completed,completed
Revenue Intelligence,AI-driven insights from sales data.,Revenue Operations (RevOps),Revenue-Intelligence.md,completed,completed
Revenue Operations (RevOps),Aligning sales/marketing/success operations.,Revenue Operations (RevOps),Revenue-Operations--RevOps-.md,completed,completed
Sales Pipeline,Visual representation of sales opportunities.,Revenue Operations (RevOps),Sales-Pipeline.md,completed,completed
Win Rate,Percentage of opportunities converted to sales.,Revenue Operations (RevOps),Win-Rate.md,completed,completed
Competitive Intelligence,Gathering information about competitors.,Sales Enablement & CRM,Competitive-Intelligence.md,completed,completed
Contact Management,Organizing information about contacts.,Sales Enablement & CRM,Contact-Management.md,completed,completed
CRM Analytics,Analyzing customer relationship data.,Sales Enablement & CRM,CRM-Analytics.md,completed,completed
CRM Integration,Connecting CRM with other systems.,Sales Enablement & CRM,CRM-Integration.md,completed,completed
Deal Stage,Phase of sales opportunity in pipeline.,Sales Enablement & CRM,Deal-Stage.md,completed,completed
Lead Management,Tracking and nurturing potential customers.,Sales Enablement & CRM,Lead-Management.md,completed,completed
Lead Qualification,Assessing prospect fit and readiness.,Sales Enablement & CRM,Lead-Qualification.md,completed,completed
Marketing Automation,Software automating marketing tasks.,Sales Enablement & CRM,Marketing-Automation.md,completed,completed
Opportunity Management,Tracking sales opportunities through stages.,Sales Enablement & CRM,Opportunity-Management.md,completed,completed
Pipeline Management,Overseeing sales opportunities and forecasting.,Sales Enablement & CRM,Pipeline-Management.md,completed,completed
Sales Automation,Automating repetitive sales tasks.,Sales Enablement & CRM,Sales-Automation.md,completed,completed
Sales Coaching,Training and developing sales skills.,Sales Enablement & CRM,Sales-Coaching.md,completed,completed
Sales Collateral,Marketing materials supporting sales.,Sales Enablement & CRM,Sales-Collateral.md,completed,completed
Sales Content Management,Organizing and accessing sales materials.,Sales Enablement & CRM,Sales-Content-Management.md,completed,completed
Sales Enablement Platform,Tools empowering sales teams.,Sales Enablement & CRM,Sales-Enablement-Platform.md,completed,completed
Sales Engagement,Interactions between sales and prospects.,Sales Enablement & CRM,Sales-Engagement.md,completed,completed
Sales Forecasting,Predicting future sales results.,Sales Enablement & CRM,Sales-Forecasting.md,completed,completed
Sales Methodology,Structured approach to selling.,Sales Enablement & CRM,Sales-Methodology.md,completed,completed
Sales Playbook,Guide for sales processes and tactics.,Sales Enablement & CRM,Sales-Playbook.md,completed,completed
Sales Process,Steps for converting prospects to customers.,Sales Enablement & CRM,Sales-Process.md,completed,completed
Sales Training,Education for sales team effectiveness.,Sales Enablement & CRM,Sales-Training.md,completed,completed
Territory Management,Assigning and managing sales regions.,Sales Enablement & CRM,Territory-Management.md,completed,completed
Alt Text,Descriptive text for images in web content.,SEO & Search Visibility,Alt-Text.md,completed,completed
Anchor Text,Clickable text in hyperlinks.,SEO & Search Visibility,Anchor-Text.md,completed,completed
Backlink,Link from external site pointing to your content.,SEO & Search Visibility,Backlink.md,completed,completed
Core Web Vitals,Google's key website performance metrics.,SEO & Search Visibility,Core-Web-Vitals.md,completed,completed
Crawl Budget,How many pages search engines will crawl.,SEO & Search Visibility,Crawl-Budget.md,completed,completed
Domain Authority,Metric predicting site's search ranking ability.,SEO & Search Visibility,Domain-Authority.md,completed,completed
Duplicate Content,Same content appearing at multiple URLs.,SEO & Search Visibility,Duplicate-Content.md,completed,completed
E-E-A-T,Experience/Expertise/Authority/Trustworthiness for SEO.,SEO & Search Visibility,E-E-A-T.md,completed,completed
Featured Snippet,Highlighted answer box in search results.,SEO & Search Visibility,Featured-Snippet.md,completed,completed
Google Search Console,Tool for monitoring site in Google search.,SEO & Search Visibility,Google-Search-Console.md,completed,completed
Heading Tags (H1-H6),HTML elements structuring content hierarchy.,SEO & Search Visibility,Heading-Tags--H1-H6-.md,completed,completed
Hreflang,HTML attribute for language targeting.,SEO & Search Visibility,Hreflang.md,completed,completed
Image Optimization,Improving images for web performance and SEO.,SEO & Search Visibility,Image-Optimization.md,completed,completed
Index Coverage,Which pages search engines have indexed.,SEO & Search Visibility,Index-Coverage.md,completed,completed
Internal Linking,Links between pages on same website.,SEO & Search Visibility,Internal-Linking.md,completed,completed
Keyword Density,Frequency of target keywords in content.,SEO & Search Visibility,Keyword-Density.md,completed,completed
Keyword Research,Finding terms people search for.,SEO & Search Visibility,Keyword-Research.md,completed,completed
Link Building,Acquiring backlinks from other sites.,SEO & Search Visibility,Link-Building.md,completed,completed
Long-Tail Keyword,Specific multi-word search phrases.,SEO & Search Visibility,Long-Tail-Keyword.md,completed,completed
Meta Description,HTML element summarizing page content.,SEO & Search Visibility,Meta-Description.md,completed,completed
Mobile-First Indexing,Google primarily using mobile version for ranking.,SEO & Search Visibility,Mobile-First-Indexing.md,completed,completed
Nofollow Link,Link that doesn't pass SEO value.,SEO & Search Visibility,Nofollow-Link.md,completed,completed
Off-Page SEO,Optimization factors outside your website.,SEO & Search Visibility,Off-Page-SEO.md,completed,completed
On-Page SEO,Optimization of individual web pages.,SEO & Search Visibility,On-Page-SEO.md,completed,completed
Organic Traffic,Visitors from unpaid search results.,SEO & Search Visibility,Organic-Traffic.md,completed,completed
Page Authority,Metric predicting page's ranking potential.,SEO & Search Visibility,Page-Authority.md,completed,completed
PageRank,Google's algorithm for ranking web pages.,SEO & Search Visibility,PageRank.md,completed,completed
Robots.txt,File instructing search engine crawlers.,SEO & Search Visibility,Robots-txt.md,completed,completed
Search Engine Optimization (SEO),Improving visibility in search results.,SEO & Search Visibility,Search-Engine-Optimization--SEO-.md,completed,completed
Search Intent,What users want to accomplish with searches.,SEO & Search Visibility,Search-Intent.md,completed,completed
Search Volume,Number of searches for specific terms.,SEO & Search Visibility,Search-Volume.md,completed,completed
SERP (Search Engine Results Page),Page displaying search results.,SEO & Search Visibility,SERP--Search-Engine-Results-Page-.md,completed,completed
Site Speed,How quickly web pages load.,SEO & Search Visibility,Site-Speed.md,completed,completed
Sitemap,File listing all pages on a website.,SEO & Search Visibility,Sitemap.md,completed,completed
Structured Data,Code helping search engines understand content.,SEO & Search Visibility,Structured-Data.md,completed,completed
Technical SEO,Optimizing site infrastructure for search.,SEO & Search Visibility,Technical-SEO.md,completed,completed
Title Tag,HTML element defining page title.,SEO & Search Visibility,Title-Tag.md,completed,completed
URL Slug,Human-readable part of URL path.,SEO & Search Visibility,URL-Slug.md,completed,completed
Voice Search Optimization,Optimizing for spoken search queries.,SEO & Search Visibility,Voice-Search-Optimization.md,completed,completed
XML Sitemap,Machine-readable list of site URLs.,SEO & Search Visibility,XML-Sitemap.md,completed,completed
Zero-Click Search,Searches answered without clicking results.,SEO & Search Visibility,Zero-Click-Search.md,completed,completed
Affordable Solutions,Cost-effective options for small businesses.,SMB (DX)-Friendly Solutions,Affordable-Solutions.md,completed,completed
All-in-One Platform,Single solution combining multiple functions.,SMB (DX)-Friendly Solutions,All-in-One-Platform.md,completed,completed
Business Automation,Automating business processes for efficiency.,SMB (DX)-Friendly Solutions,Business-Automation.md,completed,completed
Business Scalability,Ability to grow operations efficiently.,SMB (DX)-Friendly Solutions,Business-Scalability.md,completed,completed
Cloud Migration,Moving systems to cloud infrastructure.,SMB (DX)-Friendly Solutions,Cloud-Migration.md,completed,completed
Cost Optimization,Reducing expenses while maintaining value.,SMB (DX)-Friendly Solutions,Cost-Optimization.md,completed,completed
Customer Relationship Building,Developing long-term customer connections.,SMB (DX)-Friendly Solutions,Customer-Relationship-Building.md,completed,completed
Digital Adoption,Embracing digital tools and processes.,SMB (DX)-Friendly Solutions,Digital-Adoption.md,completed,completed
Digital Maturity,Organization's digital capabilities level.,SMB (DX)-Friendly Solutions,Digital-Maturity.md,completed,completed
Digital Transformation Strategy,Plan for technology-driven business change.,SMB (DX)-Friendly Solutions,Digital-Transformation-Strategy.md,completed,completed
Easy Implementation,Solutions requiring minimal setup effort.,SMB (DX)-Friendly Solutions,Easy-Implementation.md,completed,completed
Free Trial,No-cost period for testing software.,SMB (DX)-Friendly Solutions,Free-Trial.md,completed,completed
Freemium Model,Free basic version with paid upgrades.,SMB (DX)-Friendly Solutions,Freemium-Model.md,completed,completed
Implementation Partner,Vendor helping deploy solutions.,SMB (DX)-Friendly Solutions,Implementation-Partner.md,completed,completed
Implementation Timeline,Schedule for deploying new solutions.,SMB (DX)-Friendly Solutions,Implementation-Timeline.md,completed,completed
IT Budget Planning,Allocating resources for technology needs.,SMB (DX)-Friendly Solutions,IT-Budget-Planning.md,completed,completed
IT Infrastructure,Hardware and software foundation.,SMB (DX)-Friendly Solutions,IT-Infrastructure.md,completed,completed
Legacy System,Older technology still in use.,SMB (DX)-Friendly Solutions,Legacy-System.md,completed,completed
Managed Services,Outsourced IT management.,SMB (DX)-Friendly Solutions,Managed-Services.md,completed,completed
Operational Efficiency,Maximizing output from resources.,SMB (DX)-Friendly Solutions,Operational-Efficiency.md,completed,completed
Outsourcing,Contracting work to external providers.,SMB (DX)-Friendly Solutions,Outsourcing.md,completed,completed
Per-Seat Pricing,Charging based on number of users.,SMB (DX)-Friendly Solutions,Per-Seat-Pricing.md,completed,completed
Process Automation,Automating manual workflows.,SMB (DX)-Friendly Solutions,Process-Automation.md,completed,completed
Quick Deployment,Fast implementation of solutions.,SMB (DX)-Friendly Solutions,Quick-Deployment.md,completed,completed
Quick Wins,Fast-achievable benefits from initiatives.,SMB (DX)-Friendly Solutions,Quick-Wins.md,completed,completed
Remote Support,Assistance provided remotely.,SMB (DX)-Friendly Solutions,Remote-Support.md,completed,completed
SaaS (Software as a Service),Cloud-delivered software applications.,SMB (DX)-Friendly Solutions,SaaS--Software-as-a-Service-.md,completed,completed
Scalable Pricing,Costs that adjust with usage or growth.,SMB (DX)-Friendly Solutions,Scalable-Pricing.md,completed,completed
Self-Service Setup,Configuration without vendor assistance.,SMB (DX)-Friendly Solutions,Self-Service-Setup.md,completed,completed
SMB (Small and Medium Business),Companies with limited size and resources.,SMB (DX)-Friendly Solutions,SMB--Small-and-Medium-Business-.md,completed,completed
SMB Digital Transformation,Small business technology modernization.,SMB (DX)-Friendly Solutions,SMB-Digital-Transformation.md,completed,completed
SMB Technology Stack,Tools and platforms for small businesses.,SMB (DX)-Friendly Solutions,SMB-Technology-Stack.md,completed,completed
Startup Pricing,Discounted rates for new companies.,SMB (DX)-Friendly Solutions,Startup-Pricing.md,completed,completed
Subscription Model,Recurring payment for ongoing access.,SMB (DX)-Friendly Solutions,Subscription-Model.md,completed,completed
Technology Adoption,Implementing new technologies.,SMB (DX)-Friendly Solutions,Technology-Adoption.md,completed,completed
Technology Evaluation,Assessing solutions before purchase.,SMB (DX)-Friendly Solutions,Technology-Evaluation.md,completed,completed
Technology Partner,Vendor supporting technology needs.,SMB (DX)-Friendly Solutions,Technology-Partner.md,completed,completed
Time to Implement,Duration needed to deploy solution.,SMB (DX)-Friendly Solutions,Time-to-Implement.md,completed,completed
Total Cost of Ownership (TCO),Full cost of solution over time.,SMB (DX)-Friendly Solutions,Total-Cost-of-Ownership--TCO-.md,completed,completed
Training Resources,Materials for learning to use tools.,SMB (DX)-Friendly Solutions,Training-Resources.md,completed,completed
Usage-Based Pricing,Charges based on consumption.,SMB (DX)-Friendly Solutions,Usage-Based-Pricing.md,completed,completed
User-Friendly Interface,Easy-to-use design.,SMB (DX)-Friendly Solutions,User-Friendly-Interface.md,completed,completed
Vendor Comparison,Evaluating competing solutions.,SMB (DX)-Friendly Solutions,Vendor-Comparison.md,completed,completed
Vendor Selection,Choosing technology providers.,SMB (DX)-Friendly Solutions,Vendor-Selection.md,completed,completed
Audience Engagement,Interacting with social media followers.,Social Media & EC Integration,Audience-Engagement.md,completed,completed
Brand Monitoring,Tracking brand mentions online.,Social Media & EC Integration,Brand-Monitoring.md,completed,completed
Conversion Tracking,Measuring actions from social traffic.,Social Media & EC Integration,Conversion-Tracking.md,completed,completed
Influencer Marketing,Partnering with influential creators.,Social Media & EC Integration,Influencer-Marketing.md,completed,completed
Instagram Shopping,E-commerce features on Instagram.,Social Media & EC Integration,Instagram-Shopping.md,completed,completed
Live Commerce,Real-time shopping through live streaming.,Social Media & EC Integration,Live-Commerce.md,completed,completed
Meta Business Suite,Meta's tool for managing Facebook/Instagram.,Social Media & EC Integration,Meta-Business-Suite.md,completed,completed
Product Catalog,Organized listing of products.,Social Media & EC Integration,Product-Catalog.md,completed,completed
Shoppable Content,Content with direct purchase options.,Social Media & EC Integration,Shoppable-Content.md,completed,completed
Shoppable Posts,Social posts with embedded purchase links.,Social Media & EC Integration,Shoppable-Posts.md,completed,completed
Social Analytics,Metrics from social media activities.,Social Media & EC Integration,Social-Analytics.md,completed,completed
Social Calendar,Schedule for social media content.,Social Media & EC Integration,Social-Calendar.md,completed,completed
Social Commerce,Selling products through social platforms.,Social Media & EC Integration,Social-Commerce.md,completed,completed
Social CRM,Customer relationship management via social.,Social Media & EC Integration,Social-CRM.md,completed,completed
Social Engagement Rate,Ratio of interactions to reach.,Social Media & EC Integration,Social-Engagement-Rate.md,completed,completed
Social Media Advertising,Paid promotion on social platforms.,Social Media & EC Integration,Social-Media-Advertising.md,completed,completed
Social Media API,Interface for social platform data.,Social Media & EC Integration,Social-Media-API.md,completed,completed
Social Media Automation,Scheduling and automating social tasks.,Social Media & EC Integration,Social-Media-Automation.md,completed,completed
Social Media Dashboard,Unified view of social media metrics.,Social Media & EC Integration,Social-Media-Dashboard.md,completed,completed
Social Media Integration,Connecting social to business systems.,Social Media & EC Integration,Social-Media-Integration.md,completed,completed
Social Media Management,Tools for managing social presence.,Social Media & EC Integration,Social-Media-Management.md,completed,completed
Social Media Metrics,KPIs for social media performance.,Social Media & EC Integration,Social-Media-Metrics.md,completed,completed
Social Media Monitoring,Tracking social conversations.,Social Media & EC Integration,Social-Media-Monitoring.md,completed,completed
Social Media Publishing,Posting content to social platforms.,Social Media & EC Integration,Social-Media-Publishing.md,completed,completed
Social Media ROI,Return on social media investments.,Social Media & EC Integration,Social-Media-ROI.md,completed,completed
Social Media Scheduling,Planning future social posts.,Social Media & EC Integration,Social-Media-Scheduling.md,completed,completed
Social Media Strategy,Plan for social media presence.,Social Media & EC Integration,Social-Media-Strategy.md,completed,completed
Social Proof,Evidence of others' positive experiences.,Social Media & EC Integration,Social-Proof.md,completed,completed
Social Selling,Using social networks for sales.,Social Media & EC Integration,Social-Selling.md,completed,completed
User Review Management,Handling customer reviews across platforms.,Social Media & EC Integration,User-Review-Management.md,completed,completed
Base Template,Foundation template for Hugo themes.,Static Site Generation (SSG) & Hugo Workflow,Base-Template.md,completed,completed
Build Automation,Automating site generation process.,Static Site Generation (SSG) & Hugo Workflow,Build-Automation.md,completed,completed
Build Performance,Speed and efficiency of site generation.,Static Site Generation (SSG) & Hugo Workflow,Build-Performance.md,completed,completed
