keyword,definition,category,filename,status_en,status_ja
Member Journey,The progression of community members from new to engaged.,Community Management,Member-Journey.md,completed,completed
Member Recognition,Programs acknowledging valuable community contributors.,Community Management,Member-Recognition.md,completed,completed
Online Community Platform,Software for hosting and managing communities.,Community Management,Online-Community-Platform.md,completed,completed
Peer-to-Peer Support,Community members helping each other solve problems.,Community Management,Peer-to-Peer-Support.md,completed,completed
Private Community,Members-only community with restricted access.,Community Management,Private-Community.md,completed,completed
Super Users,Highly engaged community members who help others.,Community Management,Super-Users.md,completed,completed
User Groups,Organized gatherings of product users sharing experiences.,Community Management,User-Groups.md,completed,completed
Virtual Events,Online events for community engagement and education.,Community Management,Virtual-Events.md,completed,completed
Blog Post Structure,Organizing blog content for readability and SEO.,Content Distribution & Amplification,Blog-Post-Structure.md,completed,completed
Content Amplification,Promoting content to extend its reach beyond organic.,Content Distribution & Amplification,Content-Amplification.md,completed,completed
Content Calendar,Schedule planning content publication across channels.,Content Distribution & Amplification,Content-Calendar.md,completed,completed
Content Distribution Channels,Platforms and methods for sharing content.,Content Distribution & Amplification,Content-Distribution-Channels.md,completed,completed
Content Distribution Strategy,Plan for getting content in front of target audiences.,Content Distribution & Amplification,Content-Distribution-Strategy.md,completed,completed
Content Promotion,Actively marketing content to increase visibility.,Content Distribution & Amplification,Content-Promotion.md,completed,completed
Content Repurposing,Adapting content for different formats and channels.,Content Distribution & Amplification,Content-Repurposing.md,completed,completed
Content Scheduling,Planning when content will be published.,Content Distribution & Amplification,Content-Scheduling.md,completed,completed
Content Syndication,Republishing content on third-party platforms.,Content Distribution & Amplification,Content-Syndication.md,completed,completed
Cross-Promotion,Promoting content across multiple owned channels.,Content Distribution & Amplification,Cross-Promotion.md,completed,completed
Dark Social Sharing,Content sharing through private channels like messaging apps.,Content Distribution & Amplification,Dark-Social-Sharing.md,completed,completed
Email Newsletter,Regular email updates with curated content.,Content Distribution & Amplification,Email-Newsletter.md,completed,completed
Employee Advocacy,Employees sharing company content on personal networks.,Content Distribution & Amplification,Employee-Advocacy.md,completed,completed
Guest Posting,Writing content for other websites to reach new audiences.,Content Distribution & Amplification,Guest-Posting.md,completed,completed
Influencer Outreach,Engaging influencers to share or create content.,Content Distribution & Amplification,Influencer-Outreach.md,completed,completed
Newsjacking,Creating content around trending news topics.,Content Distribution & Amplification,Newsjacking.md,completed,completed
Paid Content Promotion,Using advertising to amplify content reach.,Content Distribution & Amplification,Paid-Content-Promotion.md,completed,completed
Press Release,Official statement distributed to media outlets.,Content Distribution & Amplification,Press-Release.md,completed,completed
RSS Feed,Standardized format for distributing content updates.,Content Distribution & Amplification,RSS-Feed.md,completed,completed
Social Bookmarking,Saving and sharing content links on social platforms.,Content Distribution & Amplification,Social-Bookmarking.md,completed,completed
Social Sharing,Distributing content through social media platforms.,Content Distribution & Amplification,Social-Sharing.md,completed,completed
Viral Content,Content that spreads rapidly through sharing.,Content Distribution & Amplification,Viral-Content.md,completed,completed
Webinar Marketing,Using webinars to educate audiences and generate leads.,Content Distribution & Amplification,Webinar-Marketing.md,completed,completed
Word-of-Mouth Marketing,Organic sharing through personal recommendations.,Content Distribution & Amplification,Word-of-Mouth-Marketing.md,completed,completed
Brand Journalism,Creating newsworthy content about industry and brand.,Content Marketing & Inbound Strategy,Brand-Journalism.md,completed,completed
Brand Storytelling,Using narrative to communicate brand values and mission.,Content Marketing & Inbound Strategy,Brand-Storytelling.md,completed,completed
Buyer Persona,Semi-fictional representation of ideal customers.,Content Marketing & Inbound Strategy,Buyer-Persona.md,completed,completed
Case Study,Detailed account of customer success with product/service.,Content Marketing & Inbound Strategy,Case-Study.md,completed,completed
Content Funnel,Mapping content to stages of the customer journey.,Content Marketing & Inbound Strategy,Content-Funnel.md,completed,completed
Content Marketing,Creating valuable content to attract and engage audiences.,Content Marketing & Inbound Strategy,Content-Marketing.md,completed,completed
Content Pillar,Comprehensive content piece that anchors topic clusters.,Content Marketing & Inbound Strategy,Content-Pillar.md,completed,completed
Content Strategy,Planning approach for creating and managing content.,Content Marketing & Inbound Strategy,Content-Strategy.md,completed,completed
Content Types,Different formats of content (blog/video/infographic etc.).,Content Marketing & Inbound Strategy,Content-Types.md,completed,completed
Cornerstone Content,Most important foundational content pieces on a site.,Content Marketing & Inbound Strategy,Cornerstone-Content.md,completed,completed
Customer Journey Mapping,Visualizing touchpoints throughout customer lifecycle.,Content Marketing & Inbound Strategy,Customer-Journey-Mapping.md,completed,completed
Demand Generation,Marketing activities that create interest in products.,Content Marketing & Inbound Strategy,Demand-Generation.md,completed,completed
Educational Content,Content designed to teach and inform audiences.,Content Marketing & Inbound Strategy,Educational-Content.md,completed,completed
Evergreen Content,Content that remains relevant over long periods.,Content Marketing & Inbound Strategy,Evergreen-Content.md,completed,completed
Gated Content,Content requiring form submission to access.,Content Marketing & Inbound Strategy,Gated-Content.md,completed,completed
Inbound Marketing,Attracting customers through valuable content and experiences.,Content Marketing & Inbound Strategy,Inbound-Marketing.md,completed,completed
Interactive Content,Content requiring active user participation.,Content Marketing & Inbound Strategy,Interactive-Content.md,completed,completed
Lead Generation Content,Content designed to capture prospect information.,Content Marketing & Inbound Strategy,Lead-Generation-Content.md,completed,completed
Lead Magnet,Free resource offered in exchange for contact information.,Content Marketing & Inbound Strategy,Lead-Magnet.md,completed,completed
Lead Nurturing,Developing relationships with prospects through content.,Content Marketing & Inbound Strategy,Lead-Nurturing.md,completed,completed
Long-Form Content,In-depth content typically over 2000 words.,Content Marketing & Inbound Strategy,Long-Form-Content.md,completed,completed
Pillar Page,Comprehensive hub page for topic cluster strategy.,Content Marketing & Inbound Strategy,Pillar-Page.md,completed,completed
Skyscraper Technique,Creating content better than existing top-ranking content.,Content Marketing & Inbound Strategy,Skyscraper-Technique.md,completed,completed
Thought Leadership,Establishing expertise through insightful content.,Content Marketing & Inbound Strategy,Thought-Leadership.md,completed,completed
Topic Cluster,Group of related content organized around pillar page.,Content Marketing & Inbound Strategy,Topic-Cluster.md,completed,completed
Top-of-Funnel Content,Content targeting awareness stage prospects.,Content Marketing & Inbound Strategy,Top-of-Funnel-Content.md,completed,completed
Ungated Content,Free content accessible without form submission.,Content Marketing & Inbound Strategy,Ungated-Content.md,completed,completed
User-Generated Content (UGC),Content created by customers rather than brand.,Content Marketing & Inbound Strategy,User-Generated-Content--UGC-.md,completed,completed
User-Generated Content Rights,Permissions for using customer-created content.,Content Marketing & Inbound Strategy,User-Generated-Content-Rights.md,completed,completed
Visual Content Marketing,Using images/video/infographics in content strategy.,Content Marketing & Inbound Strategy,Visual-Content-Marketing.md,completed,completed
White Paper,Authoritative report on complex topics or solutions.,Content Marketing & Inbound Strategy,White-Paper.md,completed,completed
API Gateway,Entry point managing API traffic and authentication.,Content Platform & CMS Integration,API-Gateway.md,completed,completed
CDN (Content Delivery Network),Distributed servers for faster content delivery globally.,Content Platform & CMS Integration,CDN--Content-Delivery-Network-.md,completed,completed
CMS (Content Management System),Software for creating and managing digital content.,Content Platform & CMS Integration,CMS--Content-Management-System-.md,completed,completed
CMS Migration,Moving content from one CMS platform to another.,Content Platform & CMS Integration,CMS-Migration.md,completed,completed
Content API,Interface for programmatic access to content.,Content Platform & CMS Integration,Content-API.md,completed,completed
Content Federation,Aggregating content from multiple sources.,Content Platform & CMS Integration,Content-Federation.md,completed,completed
Content Hub,Centralized platform for organizing content resources.,Content Platform & CMS Integration,Content-Hub.md,completed,completed
Content Modeling,Defining content types and their relationships.,Content Platform & CMS Integration,Content-Modeling.md,completed,completed
DAM (Digital Asset Management),System for storing and managing digital files.,Content Platform & CMS Integration,DAM--Digital-Asset-Management-.md,completed,completed
Decoupled CMS,Separating content management from content presentation.,Content Platform & CMS Integration,Decoupled-CMS.md,completed,completed
Digital Experience Platform (DXP),Integrated platform for managing digital experiences.,Content Platform & CMS Integration,Digital-Experience-Platform--DXP-.md,completed,completed
Drupal,Open-source CMS known for flexibility and community.,Content Platform & CMS Integration,Drupal.md,completed,completed
GraphQL,Query language for APIs with flexible data fetching.,Content Platform & CMS Integration,GraphQL.md,completed,completed
Headless CMS,CMS without built-in frontend delivering content via API.,Content Platform & CMS Integration,Headless-CMS.md,completed,completed
Jamstack,Modern web architecture using JavaScript/APIs/Markup.,Content Platform & CMS Integration,Jamstack.md,completed,completed
Markdown,Lightweight markup language for formatting text.,Content Platform & CMS Integration,Markdown.md,completed,completed
Middleware,Software connecting different applications or systems.,Content Platform & CMS Integration,Middleware.md,completed,completed
Omnichannel Content Delivery,Consistent content across all channels and devices.,Content Platform & CMS Integration,Omnichannel-Content-Delivery.md,completed,completed
REST API,Architectural style for building web services.,Content Platform & CMS Integration,REST-API.md,completed,completed
Structured Content,Content organized in defined fields and formats.,Content Platform & CMS Integration,Structured-Content.md,completed,completed
Traditional CMS,Coupled CMS with integrated frontend and backend.,Content Platform & CMS Integration,Traditional-CMS.md,completed,completed
Webhook,HTTP callback triggered by events in applications.,Content Platform & CMS Integration,Webhook.md,completed,completed
WordPress,Popular open-source CMS powering many websites.,Content Platform & CMS Integration,WordPress.md,completed,completed
Chatbot Persona,The personality and voice of a conversational AI.,Conversation Design & UX Writing,Chatbot-Persona.md,completed,completed
Conversation Flow Design,Mapping out dialogue paths in conversational interfaces.,Conversation Design & UX Writing,Conversation-Flow-Design.md,completed,completed
Conversation Script,Pre-written dialogue for chatbot interactions.,Conversation Design & UX Writing,Conversation-Script.md,completed,completed
Dialog Turn,Single exchange in a conversation between user and system.,Conversation Design & UX Writing,Dialog-Turn.md,completed,completed
Error Message Design,Writing clear and helpful error communications.,Conversation Design & UX Writing,Error-Message-Design.md,completed,completed
Microcopy,Small bits of text that guide users through interfaces.,Conversation Design & UX Writing,Microcopy.md,completed,completed
UX Writing,Crafting user interface text to guide and help users.,Conversation Design & UX Writing,UX-Writing.md,completed,completed
Voice and Tone Guidelines,Standards for consistent brand communication style.,Conversation Design & UX Writing,Voice-and-Tone-Guidelines.md,completed,completed
Welcome Message,Initial greeting when users start a conversation.,Conversation Design & UX Writing,Welcome-Message.md,completed,completed
Account Health Score,Metric predicting customer retention risk.,Customer Journey Orchestration,Account-Health-Score.md,completed,completed
Churn Prediction,Using data to forecast which customers will leave.,Customer Journey Orchestration,Churn-Prediction.md,completed,completed
Cross-Sell,Selling related products to existing customers.,Customer Journey Orchestration,Cross-Sell.md,completed,completed
Customer Data Platform (CDP),Unified database of customer information.,Customer Journey Orchestration,Customer-Data-Platform--CDP-.md,completed,completed
Customer Effort Score (CES),Metric measuring how easy interactions are for customers.,Customer Journey Orchestration,Customer-Effort-Score--CES-.md,completed,completed
Customer Health Score,Combined metric indicating customer relationship status.,Customer Journey Orchestration,Customer-Health-Score.md,completed,completed
Customer Lifetime Value (CLV),Total revenue expected from a customer over time.,Customer Journey Orchestration,Customer-Lifetime-Value--CLV-.md,completed,completed
Customer Onboarding,Process of getting new customers started with product.,Customer Journey Orchestration,Customer-Onboarding.md,completed,completed
Customer Retention,Strategies to keep existing customers engaged.,Customer Journey Orchestration,Customer-Retention.md,completed,completed
Customer Segmentation,Dividing customers into groups based on characteristics.,Customer Journey Orchestration,Customer-Segmentation.md,completed,completed
Journey Analytics,Analyzing customer paths across touchpoints.,Customer Journey Orchestration,Journey-Analytics.md,completed,completed
Net Revenue Retention (NRR),Recurring revenue retained including expansion/churn.,Customer Journey Orchestration,Net-Revenue-Retention--NRR-.md,completed,completed
Next Best Action,AI-driven recommendations for customer engagement.,Customer Journey Orchestration,Next-Best-Action.md,completed,completed
Omnichannel Customer Experience,Seamless experience across all interaction channels.,Customer Journey Orchestration,Omnichannel-Customer-Experience.md,completed,completed
Personalization Engine,System delivering customized content and experiences.,Customer Journey Orchestration,Personalization-Engine.md,completed,completed
Proactive Engagement,Reaching out to customers before they contact you.,Customer Journey Orchestration,Proactive-Engagement.md,completed,completed
Real-Time Personalization,Customizing experiences based on current behavior.,Customer Journey Orchestration,Real-Time-Personalization.md,completed,completed
Touchpoint,Any interaction between customer and brand.,Customer Journey Orchestration,Touchpoint.md,completed,completed
Triggered Messaging,Automated messages based on user actions or events.,Customer Journey Orchestration,Triggered-Messaging.md,completed,completed
Upsell,Encouraging customers to purchase premium versions.,Customer Journey Orchestration,Upsell.md,completed,completed
Voice of Customer (VoC),Capturing customer feedback and preferences.,Customer Journey Orchestration,Voice-of-Customer--VoC-.md,completed,completed
Win-Back Campaign,Marketing to re-engage churned customers.,Customer Journey Orchestration,Win-Back-Campaign.md,completed,completed
Zero-Party Data,Data customers intentionally share with brands.,Customer Journey Orchestration,Zero-Party-Data.md,completed,completed
Churn Analysis,Examining why customers stop using products/services.,Customer Success & Retention,Churn-Analysis.md,completed,completed
Churn Rate,Percentage of customers who stop using service over time.,Customer Success & Retention,Churn-Rate.md,completed,completed
Customer Advocacy,Customers actively promoting a brand to others.,Customer Success & Retention,Customer-Advocacy.md,completed,completed
Customer Feedback Analysis,Analyzing customer input for insights and improvements.,Customer Success & Retention,Customer-Feedback-Analysis.md,completed,completed
Customer Success Manager,Role focused on ensuring customer achieve their goals.,Customer Success & Retention,Customer-Success-Manager.md,completed,completed
Customer Success Platform,Software for managing customer success activities.,Customer Success & Retention,Customer-Success-Platform.md,completed,completed
Expansion Revenue,Additional revenue from existing customers.,Customer Success & Retention,Expansion-Revenue.md,completed,completed
Product Adoption,Extent to which customers use product features.,Customer Success & Retention,Product-Adoption.md,completed,completed
Product Usage Analytics,Tracking how customers interact with products.,Customer Success & Retention,Product-Usage-Analytics.md,completed,completed
Quarterly Business Review (QBR),"Regular meetings reviewing customer success, goals.",Customer Success & Retention,Quarterly-Business-Review--QBR-.md,completed,completed
Renewal Management,Process of managing subscription renewals.,Customer Success & Retention,Renewal-Management.md,completed,completed
Retention Rate,Percentage of customers who remain over time.,Customer Success & Retention,Retention-Rate.md,completed,completed
Retention Strategy,Planned approach to keeping customers engaged.,Customer Success & Retention,Retention-Strategy.md,completed,completed
Risk Assessment (Customer),Identifying customers at risk of churning.,Customer Success & Retention,Risk-Assessment--Customer-.md,completed,completed
Success Plan,Document outlining goals and milestones for customer.,Customer Success & Retention,Success-Plan.md,completed,completed
Time to Value,How quickly customers realize product benefits.,Customer Success & Retention,Time-to-Value.md,completed,completed
Usage Metrics,Data on how customers use product features.,Customer Success & Retention,Usage-Metrics.md,completed,completed
Access Control List (ACL),Permissions defining who can access resources.,Cybersecurity & Compliance,Access-Control-List--ACL-.md,completed,completed
API Security,Protecting APIs from unauthorized access and attacks.,Cybersecurity & Compliance,API-Security.md,completed,completed
Authentication,Verifying user identity before granting access.,Cybersecurity & Compliance,Authentication.md,completed,completed
Authorization,Determining what actions authenticated users can perform.,Cybersecurity & Compliance,Authorization.md,completed,completed
CCPA (California Consumer Privacy Act),California law protecting consumer data privacy rights.,Cybersecurity & Compliance,CCPA--California-Consumer-Privacy-Act-.md,completed,completed
Compliance Audit,Review ensuring adherence to regulations and policies.,Cybersecurity & Compliance,Compliance-Audit.md,completed,completed
Credential Management,Secure handling of usernames and passwords.,Cybersecurity & Compliance,Credential-Management.md,completed,completed
Data Anonymization,Removing identifying information from data.,Cybersecurity & Compliance,Data-Anonymization.md,completed,completed
Data Breach Response,Procedures for handling security incidents.,Cybersecurity & Compliance,Data-Breach-Response.md,completed,completed
Data Classification,Categorizing data by sensitivity and handling requirements.,Cybersecurity & Compliance,Data-Classification.md,completed,completed
Data Loss Prevention (DLP),Tools preventing unauthorized data exfiltration.,Cybersecurity & Compliance,Data-Loss-Prevention--DLP-.md,completed,completed
Data Privacy,Protecting personal information from unauthorized use.,Cybersecurity & Compliance,Data-Privacy.md,completed,completed
Data Retention Policy,Guidelines for how long data should be kept.,Cybersecurity & Compliance,Data-Retention-Policy.md,completed,completed
Encryption at Rest,Protecting stored data through encryption.,Cybersecurity & Compliance,Encryption-at-Rest.md,completed,completed
Encryption in Transit,Protecting data during transmission.,Cybersecurity & Compliance,Encryption-in-Transit.md,completed,completed
Endpoint Security,Protecting devices that connect to networks.,Cybersecurity & Compliance,Endpoint-Security.md,completed,completed
HIPAA (Health Insurance Portability),US law protecting medical information privacy.,Cybersecurity & Compliance,HIPAA--Health-Insurance-Portability-.md,completed,completed
Identity and Access Management (IAM),Framework for managing digital identities and access.,Cybersecurity & Compliance,Identity-and-Access-Management--IAM-.md,completed,completed
Multi-Factor Authentication (MFA),Requiring multiple verification methods for access.,Cybersecurity & Compliance,Multi-Factor-Authentication--MFA-.md,completed,completed
OAuth,Authorization framework for third-party access.,Cybersecurity & Compliance,OAuth.md,completed,completed
Penetration Testing,Authorized simulated attacks to find vulnerabilities.,Cybersecurity & Compliance,Penetration-Testing.md,completed,completed
Privacy by Design,Building privacy into systems from the start.,Cybersecurity & Compliance,Privacy-by-Design.md,completed,completed
Role-Based Access Control (RBAC),Access permissions based on user roles.,Cybersecurity & Compliance,Role-Based-Access-Control--RBAC-.md,completed,completed
SAML (Security Assertion Markup Language),Standard for exchanging authentication data.,Cybersecurity & Compliance,SAML--Security-Assertion-Markup-Language-.md,completed,completed
Security Information and Event Management (SIEM),Aggregating and analyzing security event data.,Cybersecurity & Compliance,Security-Information-and-Event-Management--SIEM-.md,completed,completed
Single Sign-On (SSO),Authenticating once to access multiple applications.,Cybersecurity & Compliance,Single-Sign-On--SSO-.md,completed,completed
SOC 2 Compliance,Security certification for service organizations.,Cybersecurity & Compliance,SOC-2-Compliance.md,completed,completed
Threat Detection,Identifying potential security threats in systems.,Cybersecurity & Compliance,Threat-Detection.md,completed,completed
Two-Factor Authentication (2FA),Security requiring two verification methods.,Cybersecurity & Compliance,Two-Factor-Authentication--2FA-.md,completed,completed
Vulnerability Assessment,Identifying security weaknesses in systems.,Cybersecurity & Compliance,Vulnerability-Assessment.md,completed,completed
Zero Trust Security,Security model requiring verification for all access.,Cybersecurity & Compliance,Zero-Trust-Security.md,completed,completed
Business Intelligence (BI),Systems for analyzing and visualizing business data.,Data & Analytics Infrastructure,Business-Intelligence--BI-.md,completed,completed
Data Catalog,Inventory of data assets with metadata.,Data & Analytics Infrastructure,Data-Catalog.md,completed,completed
Data Governance,Policies and processes for managing data assets.,Data & Analytics Infrastructure,Data-Governance.md,completed,completed
Data Lake,Storage repository for raw data in various formats.,Data & Analytics Infrastructure,Data-Lake.md,completed,completed
Data Lakehouse,Combining data lake and data warehouse capabilities.,Data & Analytics Infrastructure,Data-Lakehouse.md,completed,completed
Data Lineage,Tracking data origins and transformations.,Data & Analytics Infrastructure,Data-Lineage.md,completed,completed
Data Mart,Subset of data warehouse for specific business area.,Data & Analytics Infrastructure,Data-Mart.md,completed,completed
Data Mesh,Decentralized approach to enterprise data management.,Data & Analytics Infrastructure,Data-Mesh.md,completed,completed
Data Quality,Measuring accuracy/completeness/reliability of data.,Data & Analytics Infrastructure,Data-Quality.md,completed,completed
Data Warehouse,Centralized repository for structured analytical data.,Data & Analytics Infrastructure,Data-Warehouse.md,completed,completed
ETL (Extract Transform Load),Process for moving and transforming data.,Data & Analytics Infrastructure,ETL--Extract-Transform-Load-.md,completed,completed
Event Streaming,Processing real-time data streams as they occur.,Data & Analytics Infrastructure,Event-Streaming.md,completed,completed
