keyword,definition,category,filename,status_en,status_ja
Active Learning,A machine learning process where the model explicitly asks a human to label data points it is uncertain about.,AI Chatbot & Automation,Active-Learning.md,completed,completed
Adaptive Cards,"A platform-agnostic UI framework allowing developers to exchange rich content cards (images, text, forms) in a common format.",AI Chatbot & Automation,Adaptive-Cards.md,completed,completed
Aggregator,A node that collects outputs from multiple execution paths or loops and combines them into a single result.,AI Chatbot & Automation,Aggregator.md,completed,completed
Aspect-Based Sentiment Analysis,Sentiment analysis that focuses on specific aspects or attributes of a product/service rather than overall sentiment.,Application & Use-Cases,Aspect-Based-Sentiment-Analysis.md,completed,completed
Code Generation,The AI capability to automatically create programming code from natural language descriptions.,Application & Use-Cases,Code-Generation.md,completed,completed
Code Interpreter,"An AI tool that can write, execute, and debug code in real-time during a conversation.",Application & Use-Cases,Code-Interpreter.md,completed,completed
Content Summarization,AI-driven text summarization that condenses large documents while preserving key information.,Application & Use-Cases,Content-Summarization.md,completed,completed
Demand Forecasting,Using AI and ML to predict future product demand based on historical data and market trends.,Application & Use-Cases,Demand-Forecasting.md,completed,completed
EdTech Personalized Learning,AI-powered education technology that adapts learning paths to individual student needs.,Application & Use-Cases,EdTech-Personalized-Learning.md,completed,completed
FinTech Fraud Detection,Financial technology systems using AI to identify and prevent fraudulent transactions.,Application & Use-Cases,FinTech-Fraud-Detection.md,completed,completed
Financial Risk Management,Using AI models to assess and mitigate risks in financial portfolios and investments.,Application & Use-Cases,Financial-Risk-Management.md,completed,completed
Fraud Detection,Systems that use ML algorithms to identify suspicious patterns indicating fraudulent activity.,Application & Use-Cases,Fraud-Detection.md,completed,completed
HealthTech Diagnosis,AI systems that assist healthcare providers in diagnosing medical conditions.,Application & Use-Cases,HealthTech-Diagnosis.md,completed,completed
HR Talent Acquisition,AI-powered tools for sourcing and screening job candidates.,Application & Use-Cases,HR-Talent-Acquisition.md,completed,completed
HR Tech Resume Screening,Automated systems that filter and rank job applications based on criteria.,Application & Use-Cases,HR-Tech-Resume-Screening.md,completed,completed
Lead Scoring,Ranking prospects based on their likelihood to convert using predictive analytics.,Application & Use-Cases,Lead-Scoring.md,completed,completed
Legal Contract Analysis,AI tools that review and extract key clauses from legal documents.,Application & Use-Cases,Legal-Contract-Analysis.md,completed,completed
Market Basket Analysis,Analyzing purchase patterns to identify product associations and cross-selling opportunities.,Application & Use-Cases,Market-Basket-Analysis.md,completed,completed
Medical Image Analysis,AI systems that interpret medical imaging like X-rays and MRIs.,Application & Use-Cases,Medical-Image-Analysis.md,completed,completed
Personalized Email Marketing,Using AI to tailor email content to individual recipient preferences and behaviors.,Application & Use-Cases,Personalized-Email-Marketing.md,completed,completed
Predictive Maintenance,Using AI to forecast equipment failures before they occur.,Application & Use-Cases,Predictive-Maintenance.md,completed,completed
Price Optimization,AI-driven dynamic pricing strategies based on demand and competition.,Application & Use-Cases,Price-Optimization.md,completed,completed
Recommendation Engine,Systems that suggest products or content based on user behavior and preferences.,Application & Use-Cases,Recommendation-Engine.md,completed,completed
Retail Demand Forecasting,Predicting consumer demand patterns specifically for retail inventory planning.,Application & Use-Cases,Retail-Demand-Forecasting.md,completed,completed
Smart Contract,Self-executing contracts with terms directly written into code on blockchain.,Application & Use-Cases,Smart-Contract.md,completed,completed
Speech-to-Text,Converting spoken language into written text using AI recognition.,Application & Use-Cases,Speech-to-Text.md,completed,completed
Text-to-Speech,AI systems that convert written text into natural-sounding spoken audio.,Application & Use-Cases,Text-to-Speech.md,completed,completed
AI Art Generation,Creating visual artwork using generative AI models like DALL-E or Midjourney.,Generative AI¼Content Generation,AI-Art-Generation.md,completed,completed
AI Copywriting,Using AI to generate marketing copy and advertising content.,Generative AI¼Content Generation,AI-Copywriting.md,completed,completed
AI Video Generation,Creating video content using AI without traditional filming.,Generative AI¼Content Generation,AI-Video-Generation.md,completed,completed
AI Writing Assistant,Tools that help users write by suggesting completions and improvements.,Generative AI¼Content Generation,AI-Writing-Assistant.md,completed,completed
Automated Content Generation,Systems that create content automatically based on data or templates.,Generative AI¼Content Generation,Automated-Content-Generation.md,completed,completed
Generative Adversarial Network (GAN),Neural network architecture where two networks compete to generate realistic outputs.,Generative AI¼Content Generation,Generative-Adversarial-Network--GAN-.md,completed,completed
Text Generation,AI models that produce coherent text based on prompts.,Generative AI¼Content Generation,Text-Generation.md,completed,completed
Variational Autoencoder (VAE),Generative model that learns latent representations for creating new data.,Generative AI¼Content Generation,Variational-Autoencoder--VAE-.md,completed,completed
Video Synthesis,AI techniques for generating or manipulating video content.,Generative AI¼Content Generation,Video-Synthesis.md,completed,completed
Voice Cloning,AI technology that replicates a specific person's voice.,Generative AI¼Content Generation,Voice-Cloning.md,completed,completed
Chain-of-Thought Prompting,A prompting technique that encourages models to show step-by-step reasoning.,Prompting & Interfaces,Chain-of-Thought-Prompting.md,completed,completed
Contextual Prompt,Prompts that include relevant background information to guide AI responses.,Prompting & Interfaces,Contextual-Prompt.md,completed,completed
Few-Shot Learning,Training AI with only a small number of examples.,Prompting & Interfaces,Few-Shot-Learning.md,completed,completed
In-Context Learning,The ability of LLMs to learn from examples provided within the prompt.,Prompting & Interfaces,In-Context-Learning.md,completed,completed
Instruction Tuning,Fine-tuning models to better follow natural language instructions.,Prompting & Interfaces,Instruction-Tuning.md,completed,completed
Prompt Chaining,Connecting multiple prompts where output of one becomes input for another.,Prompting & Interfaces,Prompt-Chaining.md,completed,completed
Prompt Engineering,The practice of crafting effective prompts to get desired AI outputs.,Prompting & Interfaces,Prompt-Engineering.md,completed,completed
Prompt Injection,Malicious technique to manipulate AI systems through crafted inputs.,Prompting & Interfaces,Prompt-Injection.md,completed,completed
ReAct Prompting,Combining reasoning and acting in prompts for complex task completion.,Prompting & Interfaces,ReAct-Prompting.md,completed,completed
Self-Consistency Prompting,Generating multiple reasoning paths and selecting the most consistent answer.,Prompting & Interfaces,Self-Consistency-Prompting.md,completed,completed
System Prompt,Initial instructions that define how an AI assistant should behave.,Prompting & Interfaces,System-Prompt.md,completed,completed
Temperature (LLM),Parameter controlling randomness in model outputs.,Prompting & Interfaces,Temperature--LLM-.md,completed,completed
Token,The basic unit of text processing in language models.,Prompting & Interfaces,Token.md,completed,completed
Top-K Sampling,Sampling method that limits choices to the K most likely next tokens.,Prompting & Interfaces,Top-K-Sampling.md,completed,completed
Top-P Sampling,Nucleus sampling method based on cumulative probability threshold.,Prompting & Interfaces,Top-P-Sampling.md,completed,completed
Tree of Thoughts,Advanced prompting technique exploring multiple reasoning branches.,Prompting & Interfaces,Tree-of-Thoughts.md,completed,completed
Zero-Shot Learning,AI performing tasks without any task-specific training examples.,Prompting & Interfaces,Zero-Shot-Learning.md,completed,completed
Cross-Validation,Model evaluation technique using multiple train/test splits.,Machine Learning Lifecycle,Cross-Validation.md,completed,completed
Data Augmentation,Techniques to artificially increase training data variety.,Machine Learning Lifecycle,Data-Augmentation.md,completed,completed
Early Stopping,Halting training when validation performance stops improving.,Machine Learning Lifecycle,Early-Stopping.md,completed,completed
Ensemble Learning,Combining multiple models to improve prediction accuracy.,Machine Learning Lifecycle,Ensemble-Learning.md,completed,completed
Feature Engineering,Creating new input features from raw data to improve models.,Machine Learning Lifecycle,Feature-Engineering.md,completed,completed
Gradient Descent,Optimization algorithm for minimizing loss functions in ML.,Machine Learning Lifecycle,Gradient-Descent.md,completed,completed
Hyperparameter Tuning,Optimizing model settings that aren't learned during training.,Machine Learning Lifecycle,Hyperparameter-Tuning.md,completed,completed
Learning Rate,Parameter controlling how much model weights update during training.,Machine Learning Lifecycle,Learning-Rate.md,completed,completed
Mini-Batch,Processing a subset of training data in each iteration.,Machine Learning Lifecycle,Mini-Batch.md,completed,completed
Model Compression,Techniques to reduce model size while maintaining performance.,Machine Learning Lifecycle,Model-Compression.md,completed,completed
Model Deployment,The process of making trained models available for production use.,Machine Learning Lifecycle,Model-Deployment.md,completed,completed
Model Drift,Performance degradation when production data differs from training data.,Machine Learning Lifecycle,Model-Drift.md,completed,completed
Model Evaluation,Assessing model performance using metrics and test data.,Machine Learning Lifecycle,Model-Evaluation.md,completed,completed
Model Monitoring,Tracking model performance in production environments.,Machine Learning Lifecycle,Model-Monitoring.md,completed,completed
Model Retraining,Updating models with new data to maintain accuracy.,Machine Learning Lifecycle,Model-Retraining.md,completed,completed
Overfitting,When models memorize training data instead of generalizing.,Machine Learning Lifecycle,Overfitting.md,completed,completed
Regularization,Techniques to prevent overfitting by penalizing complexity.,Machine Learning Lifecycle,Regularization.md,completed,completed
Test Set,Data held out for final model evaluation.,Machine Learning Lifecycle,Test-Set.md,completed,completed
Training Pipeline,Automated workflow for preparing data and training models.,Machine Learning Lifecycle,Training-Pipeline.md,completed,completed
Underfitting,When models are too simple to capture data patterns.,Machine Learning Lifecycle,Underfitting.md,completed,completed
Validation Set,Data used to tune hyperparameters during development.,Machine Learning Lifecycle,Validation-Set.md,completed,completed
Weight Initialization,Strategies for setting initial neural network parameters.,Machine Learning Lifecycle,Weight-Initialization.md,completed,completed
Attention Mechanism,Neural network component that focuses on relevant input parts.,Model Training & Data,Attention-Mechanism.md,completed,completed
Backpropagation,Algorithm for computing gradients in neural networks.,Model Training & Data,Backpropagation.md,completed,completed
Batch Normalization,Technique to normalize layer inputs during training.,Model Training & Data,Batch-Normalization.md,completed,completed
BERT,Bidirectional transformer model for understanding language context.,Model Training & Data,BERT.md,completed,completed
Convolutional Neural Network (CNN),Neural network architecture specialized for image processing.,Model Training & Data,Convolutional-Neural-Network--CNN-.md,completed,completed
Data Labeling,The process of annotating data with correct outputs for supervised learning.,Model Training & Data,Data-Labeling.md,completed,completed
Data Pipeline,Automated workflow for collecting and processing training data.,Model Training & Data,Data-Pipeline.md,completed,completed
Data Preprocessing,Cleaning and transforming raw data before model training.,Model Training & Data,Data-Preprocessing.md,completed,completed
Dropout,Regularization technique that randomly disables neurons during training.,Model Training & Data,Dropout.md,completed,completed
Embedding,Dense vector representation of discrete data like words or categories.,Model Training & Data,Embedding.md,completed,completed
Fine-Tuning,Adapting pre-trained models for specific tasks with additional training.,Model Training & Data,Fine-Tuning.md,completed,completed
GPT,Generative Pre-trained Transformer architecture for language generation.,Model Training & Data,GPT.md,completed,completed
Long Short-Term Memory (LSTM),Recurrent neural network architecture for sequential data.,Model Training & Data,Long-Short-Term-Memory--LSTM-.md,completed,completed
Loss Function,Mathematical function measuring model prediction errors.,Model Training & Data,Loss-Function.md,completed,completed
Pre-Training,Initial training phase on large datasets before fine-tuning.,Model Training & Data,Pre-Training.md,completed,completed
Recurrent Neural Network (RNN),Neural network designed for sequential data processing.,Model Training & Data,Recurrent-Neural-Network--RNN-.md,completed,completed
Synthetic Data,Artificially generated data used for training when real data is limited.,Model Training & Data,Synthetic-Data.md,completed,completed
Tokenization,Breaking text into smaller units for model processing.,Model Training & Data,Tokenization.md,completed,completed
Transfer Learning,Using knowledge from one task to improve performance on another.,Model Training & Data,Transfer-Learning.md,completed,completed
Transformer,Neural network architecture based on self-attention mechanisms.,Model Training & Data,Transformer.md,completed,completed
Word2Vec,Neural network model producing word embeddings from text.,Model Training & Data,Word2Vec.md,completed,completed
A/B Testing,Comparing two versions to determine which performs better.,Analytics & Content Effectiveness,A-B-Testing.md,completed,completed
Attribution Analysis,Determining which touchpoints contribute to conversions.,Analytics & Content Effectiveness,Attribution-Analysis.md,completed,completed
Behavior Flow Analysis,Visualizing how users navigate through a website.,Analytics & Content Effectiveness,Behavior-Flow-Analysis.md,completed,completed
Content Analytics,Measuring how content performs across channels.,Analytics & Content Effectiveness,Content-Analytics.md,completed,completed
Content Gap Analysis,Identifying topics competitors cover that you don't.,Analytics & Content Effectiveness,Content-Gap-Analysis.md,completed,completed
Content Performance Dashboard,Visual interface showing content metrics and KPIs.,Analytics & Content Effectiveness,Content-Performance-Dashboard.md,completed,completed
Content ROI,Calculating return on investment for content marketing efforts.,Analytics & Content Effectiveness,Content-ROI.md,completed,completed
Conversion Rate Optimization (CRO),Improving the percentage of visitors who complete desired actions.,Analytics & Content Effectiveness,Conversion-Rate-Optimization--CRO-.md,completed,completed
Custom Dimension,User-defined attributes for tracking in analytics platforms.,Analytics & Content Effectiveness,Custom-Dimension.md,completed,completed
Data Visualization Best Practices,Guidelines for creating effective visual data representations.,Analytics & Content Effectiveness,Data-Visualization-Best-Practices.md,completed,completed
Goal Tracking,Measuring completion of defined objectives in analytics.,Analytics & Content Effectiveness,Goal-Tracking.md,completed,completed
Multichannel Attribution,Assigning conversion credit across multiple marketing channels.,Analytics & Content Effectiveness,Multichannel-Attribution.md,completed,completed
Session Duration,The length of time a user spends on a website in one visit.,Analytics & Content Effectiveness,Session-Duration.md,completed,completed
Time on Page,Metric measuring how long users spend on individual pages.,Analytics & Content Effectiveness,Time-on-Page.md,completed,completed
ACD (Automatic Call Distribution),System that routes incoming calls to appropriate agents.,Call Center Functionality,ACD--Automatic-Call-Distribution-.md,completed,completed
Agent Assist,AI tools that help agents during customer interactions.,Call Center Functionality,Agent-Assist.md,completed,completed
Agent Occupancy,Percentage of time agents spend on customer interactions.,Call Center Functionality,Agent-Occupancy.md,completed,completed
Average Handle Time (AHT),Mean duration of customer service interactions.,Call Center Functionality,Average-Handle-Time--AHT-.md,completed,completed
Average Speed of Answer (ASA),Mean time customers wait before reaching an agent.,Call Center Functionality,Average-Speed-of-Answer--ASA-.md,completed,completed
Call Barging,Supervisor joining a live call to assist or intervene.,Call Center Functionality,Call-Barging.md,completed,completed
Call Center CRM Integration,Connecting contact center with customer relationship management.,Call Center Functionality,Call-Center-CRM-Integration.md,completed,completed
Call Monitoring,Supervisors listening to live or recorded calls for quality.,Call Center Functionality,Call-Monitoring.md,completed,completed
Call Parking,Placing a call on hold accessible from any extension.,Call Center Functionality,Call-Parking.md,completed,completed
Call Queue,Holding area for calls waiting to be answered.,Call Center Functionality,Call-Queue.md,completed,completed
Call Recording,Capturing audio of customer conversations for review.,Call Center Functionality,Call-Recording.md,completed,completed
Call Routing,Directing calls to appropriate agents based on criteria.,Call Center Functionality,Call-Routing.md,completed,completed
Call Transfer,Moving a call from one agent to another.,Call Center Functionality,Call-Transfer.md,completed,completed
Call Whisper,Supervisor providing guidance to agent without customer hearing.,Call Center Functionality,Call-Whisper.md,completed,completed
Callback Queue,System allowing customers to receive calls back instead of waiting.,Call Center Functionality,Callback-Queue.md,completed,completed
Contact Center as a Service (CCaaS),Cloud-based contact center platform delivered as subscription.,Call Center Functionality,Contact-Center-as-a-Service--CCaaS-.md,completed,completed
Customer Callback,Feature letting customers request a return call rather than hold.,Call Center Functionality,Customer-Callback.md,completed,completed
Dialer (Predictive/Progressive),Automated systems for outbound calling campaigns.,Call Center Functionality,Dialer--Predictive-Progressive-.md,completed,completed
IVR (Interactive Voice Response),Automated phone system responding to voice or keypad inputs.,Call Center Functionality,IVR--Interactive-Voice-Response-.md,completed,completed
Omnichannel Contact Center,Contact center handling all communication channels seamlessly.,Call Center Functionality,Omnichannel-Contact-Center.md,completed,completed
Outbound Dialing,Initiating calls to customers for sales or service.,Call Center Functionality,Outbound-Dialing.md,completed,completed
Screen Pop,Automatic display of customer info when call is answered.,Call Center Functionality,Screen-Pop.md,completed,completed
Service Level Agreement (SLA),Commitment to answer calls within specified time targets.,Call Center Functionality,Service-Level-Agreement--SLA-.md,completed,completed
Skills-Based Routing,Directing customers to agents with specific expertise.,Call Center Functionality,Skills-Based-Routing.md,completed,completed
Workforce Management (WFM),Optimizing staffing levels and schedules for contact centers.,Call Center Functionality,Workforce-Management--WFM-.md,completed,completed
Bring Your Own Carrier (BYOC),Using existing telecom provider with cloud communication platform.,Cloud Telephony & VoIP Infrastructure,Bring-Your-Own-Carrier--BYOC-.md,completed,completed
Call Analytics,Analysis of call data for insights and optimization.,Cloud Telephony & VoIP Infrastructure,Call-Analytics.md,completed,completed
Cloud PBX,Virtual private branch exchange hosted in the cloud.,Cloud Telephony & VoIP Infrastructure,Cloud-PBX.md,completed,completed
Codec,Algorithm for encoding and decoding voice data.,Cloud Telephony & VoIP Infrastructure,Codec.md,completed,completed
Direct Inward Dialing (DID),Assigning individual numbers to employees on shared system.,Cloud Telephony & VoIP Infrastructure,Direct-Inward-Dialing--DID-.md,completed,completed
E.164,International telephone numbering standard.,Cloud Telephony & VoIP Infrastructure,E-164.md,completed,completed
Jitter,Variation in packet arrival time affecting call quality.,Cloud Telephony & VoIP Infrastructure,Jitter.md,completed,completed
MOS (Mean Opinion Score),Metric for measuring voice quality in telecommunications.,Cloud Telephony & VoIP Infrastructure,MOS--Mean-Opinion-Score-.md,completed,completed
Number Porting,Transferring phone numbers between carriers.,Cloud Telephony & VoIP Infrastructure,Number-Porting.md,completed,completed
PBX (Private Branch Exchange),Private telephone network used within organizations.,Cloud Telephony & VoIP Infrastructure,PBX--Private-Branch-Exchange-.md,completed,completed
QoS (Quality of Service),Prioritizing voice traffic for consistent call quality.,Cloud Telephony & VoIP Infrastructure,QoS--Quality-of-Service-.md,completed,completed
RTP (Real-time Transport Protocol),Protocol for delivering audio and video over networks.,Cloud Telephony & VoIP Infrastructure,RTP--Real-time-Transport-Protocol-.md,completed,completed
Session Border Controller (SBC),Device managing VoIP sessions at network boundaries.,Cloud Telephony & VoIP Infrastructure,Session-Border-Controller--SBC-.md,completed,completed
SIP (Session Initiation Protocol),Protocol for initiating and managing voice/video sessions.,Cloud Telephony & VoIP Infrastructure,SIP--Session-Initiation-Protocol-.md,completed,completed
SIP Trunking,Using SIP to connect PBX to the public telephone network.,Cloud Telephony & VoIP Infrastructure,SIP-Trunking.md,completed,completed
Softphone,Software application for making calls over the internet.,Cloud Telephony & VoIP Infrastructure,Softphone.md,completed,completed
Toll-Free Number,Phone numbers that are free for callers to dial.,Cloud Telephony & VoIP Infrastructure,Toll-Free-Number.md,completed,completed
Unified Communications,Integration of voice/video/messaging into single platform.,Cloud Telephony & VoIP Infrastructure,Unified-Communications.md,completed,completed
Virtual Phone Number,Cloud-based phone numbers not tied to physical lines.,Cloud Telephony & VoIP Infrastructure,Virtual-Phone-Number.md,completed,completed
VoIP (Voice over IP),Technology for making voice calls over the internet.,Cloud Telephony & VoIP Infrastructure,VoIP--Voice-over-IP-.md,completed,completed
WebRTC,Browser-based real-time communication technology.,Cloud Telephony & VoIP Infrastructure,WebRTC.md,completed,completed
Community Building,Strategies for creating and growing engaged communities.,Community Management,Community-Building.md,completed,completed
Community Engagement,Fostering active participation within communities.,Community Management,Community-Engagement.md,completed,completed
Community Guidelines,Rules and standards for community behavior.,Community Management,Community-Guidelines.md,completed,completed
Community Management Tools,Software for managing online communities.,Community Management,Community-Management-Tools.md,completed,completed
Community Metrics,KPIs for measuring community health and engagement.,Community Management,Community-Metrics.md,completed,completed
Community Moderation,Enforcing guidelines and managing community discussions.,Community Management,Community-Moderation.md,completed,completed
Community Onboarding,Process of welcoming and orienting new members.,Community Management,Community-Onboarding.md,completed,completed
Community Segmentation,Dividing community into groups for targeted engagement.,Community Management,Community-Segmentation.md,completed,completed
Customer Advocacy Program,Turning satisfied customers into brand advocates.,Community Management,Customer-Advocacy-Program.md,completed,completed
Discussion Forums,Online spaces for community conversations and Q&A.,Community Management,Discussion-Forums.md,completed,completed
Expert Community,Community of specialists sharing knowledge in a domain.,Community Management,Expert-Community.md,completed,completed
Gamification in Communities,Using game elements to drive community engagement.,Community Management,Gamification-in-Communities.md,completed,completed
