keyword,definition,category,filename,status_en,status_ja
First-Party Data,Data collected directly from customers.,Data & Analytics Infrastructure,First-Party-Data.md,completed,completed
Master Data Management (MDM),Managing critical business data for consistency.,Data & Analytics Infrastructure,Master-Data-Management--MDM-.md,completed,completed
Metadata Management,Organizing information about data assets.,Data & Analytics Infrastructure,Metadata-Management.md,completed,completed
Real-Time Analytics,Analyzing data as it's generated.,Data & Analytics Infrastructure,Real-Time-Analytics.md,completed,completed
Reverse ETL,Syncing data from warehouse back to operational tools.,Data & Analytics Infrastructure,Reverse-ETL.md,completed,completed
Schema,Structure defining data organization and relationships.,Data & Analytics Infrastructure,Schema.md,completed,completed
Snowflake Schema,Data warehouse schema with normalized dimension tables.,Data & Analytics Infrastructure,Snowflake-Schema.md,completed,completed
Star Schema,Data warehouse schema with central fact table.,Data & Analytics Infrastructure,Star-Schema.md,completed,completed
Streaming Analytics,Analyzing data in motion as it flows through systems.,Data & Analytics Infrastructure,Streaming-Analytics.md,completed,completed
Third-Party Data,Data purchased from external providers.,Data & Analytics Infrastructure,Third-Party-Data.md,completed,completed
Change Management,Process for managing organizational transitions.,Digital Workplace & Employee Experience,Change-Management.md,completed,completed
Collaboration Platform,Tools enabling teamwork across locations.,Digital Workplace & Employee Experience,Collaboration-Platform.md,completed,completed
Digital Adoption Platform,Software guiding users through applications.,Digital Workplace & Employee Experience,Digital-Adoption-Platform.md,completed,completed
Digital Workplace Strategy,Plan for technology-enabled work environment.,Digital Workplace & Employee Experience,Digital-Workplace-Strategy.md,completed,completed
Employee Engagement Platform,Tools for measuring and improving engagement.,Digital Workplace & Employee Experience,Employee-Engagement-Platform.md,completed,completed
Employee Experience (EX),Overall experience employees have at work.,Digital Workplace & Employee Experience,Employee-Experience--EX-.md,completed,completed
Employee Feedback,Mechanisms for gathering worker input.,Digital Workplace & Employee Experience,Employee-Feedback.md,completed,completed
Employee Net Promoter Score (eNPS),Measuring employee loyalty and satisfaction.,Digital Workplace & Employee Experience,Employee-Net-Promoter-Score--eNPS-.md,completed,completed
Employee Onboarding,Process of integrating new hires.,Digital Workplace & Employee Experience,Employee-Onboarding.md,completed,completed
Employee Portal,Internal platform for accessing company resources.,Digital Workplace & Employee Experience,Employee-Portal.md,completed,completed
Employee Self-Service,Systems letting employees manage their own HR tasks.,Digital Workplace & Employee Experience,Employee-Self-Service.md,completed,completed
HR Analytics,Using data to improve human resources decisions.,Digital Workplace & Employee Experience,HR-Analytics.md,completed,completed
HR Service Delivery,How HR provides services to employees.,Digital Workplace & Employee Experience,HR-Service-Delivery.md,completed,completed
Internal Communications,Channels for communicating within organization.,Digital Workplace & Employee Experience,Internal-Communications.md,completed,completed
IT Service Catalog,Menu of available IT services for employees.,Digital Workplace & Employee Experience,IT-Service-Catalog.md,completed,completed
Learning Management System (LMS),Platform for delivering training content.,Digital Workplace & Employee Experience,Learning-Management-System--LMS-.md,completed,completed
Mobile Workforce,Employees working remotely or on the go.,Digital Workplace & Employee Experience,Mobile-Workforce.md,completed,completed
People Analytics,Using employee data for workforce insights.,Digital Workplace & Employee Experience,People-Analytics.md,completed,completed
Pulse Survey,Short frequent surveys measuring employee sentiment.,Digital Workplace & Employee Experience,Pulse-Survey.md,completed,completed
Remote Work Tools,Technology enabling distributed work.,Digital Workplace & Employee Experience,Remote-Work-Tools.md,completed,completed
Skills Gap Analysis,Identifying training needs across workforce.,Digital Workplace & Employee Experience,Skills-Gap-Analysis.md,completed,completed
Talent Development,Programs for growing employee capabilities.,Digital Workplace & Employee Experience,Talent-Development.md,completed,completed
Team Collaboration,Tools and practices for group work.,Digital Workplace & Employee Experience,Team-Collaboration.md,completed,completed
Training Effectiveness,Measuring impact of learning programs.,Digital Workplace & Employee Experience,Training-Effectiveness.md,completed,completed
Workflow Automation,Automating routine business processes.,Digital Workplace & Employee Experience,Workflow-Automation.md,completed,completed
Approval Workflow,Process requiring authorization at stages.,Editorial & Content Operations,Approval-Workflow.md,completed,completed
Asset Library,Repository for storing content assets.,Editorial & Content Operations,Asset-Library.md,completed,completed
Brand Guidelines,Standards for consistent brand presentation.,Editorial & Content Operations,Brand-Guidelines.md,completed,completed
Content Aging,Managing content relevance over time.,Editorial & Content Operations,Content-Aging.md,completed,completed
Content Archiving,Storing older content for future reference.,Editorial & Content Operations,Content-Archiving.md,completed,completed
Content Audit,Systematic review of existing content.,Editorial & Content Operations,Content-Audit.md,completed,completed
Content Brief,Document outlining requirements for content piece.,Editorial & Content Operations,Content-Brief.md,completed,completed
Content Expiration,Automatic removal of outdated content.,Editorial & Content Operations,Content-Expiration.md,completed,completed
Content Governance,Framework for managing content standards and processes.,Editorial & Content Operations,Content-Governance.md,completed,completed
Content Inventory,Catalog of all content assets.,Editorial & Content Operations,Content-Inventory.md,completed,completed
Content Lifecycle Management,Managing content from creation to retirement.,Editorial & Content Operations,Content-Lifecycle-Management.md,completed,completed
Content Migration,Moving content between systems or platforms.,Editorial & Content Operations,Content-Migration.md,completed,completed
Content Operations (Content Ops),Processes and tools for content production.,Editorial & Content Operations,Content-Operations--Content-Ops-.md,completed,completed
Content Staging,Testing content before publishing live.,Editorial & Content Operations,Content-Staging.md,completed,completed
Content Velocity,Speed of content production and publication.,Editorial & Content Operations,Content-Velocity.md,completed,completed
Content Workflow,Steps and approvals for content production.,Editorial & Content Operations,Content-Workflow.md,completed,completed
Editorial Calendar,Schedule for planned content publication.,Editorial & Content Operations,Editorial-Calendar.md,completed,completed
Editorial Guidelines,Standards for content style and quality.,Editorial & Content Operations,Editorial-Guidelines.md,completed,completed
Localization,Adapting content for different languages/regions.,Editorial & Content Operations,Localization.md,completed,completed
Localization Management,Coordinating multi-language content versions.,Editorial & Content Operations,Localization-Management.md,completed,completed
Multi-Author Workflow,Process supporting multiple content creators.,Editorial & Content Operations,Multi-Author-Workflow.md,completed,completed
Publishing Workflow,Process for moving content from draft to live.,Editorial & Content Operations,Publishing-Workflow.md,completed,completed
Quality Assurance (QA),Testing content for accuracy and quality.,Editorial & Content Operations,Quality-Assurance--QA-.md,completed,completed
Review Workflow,Process for content feedback and approval.,Editorial & Content Operations,Review-Workflow.md,completed,completed
Role-Based Permissions,Access rights based on user roles.,Editorial & Content Operations,Role-Based-Permissions.md,completed,completed
Style Guide,Document defining writing and design standards.,Editorial & Content Operations,Style-Guide.md,completed,completed
Translation Memory,Database of previously translated content.,Editorial & Content Operations,Translation-Memory.md,completed,completed
Translation Workflow,Process for creating multi-language content.,Editorial & Content Operations,Translation-Workflow.md,completed,completed
Version Control,Tracking changes to content over time.,Editorial & Content Operations,Version-Control.md,completed,completed
Workflow Optimization,Improving efficiency of content processes.,Editorial & Content Operations,Workflow-Optimization.md,completed,completed
Workflow Template,Pre-built process for common content tasks.,Editorial & Content Operations,Workflow-Template.md,completed,completed
Writing Guidelines,Standards for creating written content.,Editorial & Content Operations,Writing-Guidelines.md,completed,completed
Affective Computing,AI that recognizes and responds to human emotions.,Emerging Trends & Future Tech,Affective-Computing.md,completed,completed
Autonomous Systems,Systems operating independently without human control.,Emerging Trends & Future Tech,Autonomous-Systems.md,completed,completed
Brain-Computer Interface,Direct communication between brain and computer.,Emerging Trends & Future Tech,Brain-Computer-Interface.md,completed,completed
Digital Twin,Virtual replica of physical objects or systems.,Emerging Trends & Future Tech,Digital-Twin.md,completed,completed
Explainable AI (XAI),Making AI decisions interpretable to humans.,Emerging Trends & Future Tech,Explainable-AI--XAI-.md,completed,completed
Federated Learning,Training models across decentralized data sources.,Emerging Trends & Future Tech,Federated-Learning.md,completed,completed
Quantum Machine Learning,Applying quantum computing to ML algorithms.,Emerging Trends & Future Tech,Quantum-Machine-Learning.md,completed,completed
Responsible AI,Ethical frameworks for AI development and deployment.,Emerging Trends & Future Tech,Responsible-AI.md,completed,completed
Swarm Intelligence,Collective behavior of decentralized systems.,Emerging Trends & Future Tech,Swarm-Intelligence.md,completed,completed
Knowledge Article,Individual piece of content in knowledge base.,Knowledge Base & Self-Service,Knowledge-Article.md,completed,completed
Knowledge Base Architecture,Structure and organization of knowledge systems.,Knowledge Base & Self-Service,Knowledge-Base-Architecture.md,completed,completed
Knowledge Base Software,Tools for creating and managing knowledge bases.,Knowledge Base & Self-Service,Knowledge-Base-Software.md,completed,completed
Knowledge Capture,Process of documenting organizational knowledge.,Knowledge Base & Self-Service,Knowledge-Capture.md,completed,completed
Knowledge Curation,Maintaining quality and relevance of knowledge content.,Knowledge Base & Self-Service,Knowledge-Curation.md,completed,completed
Knowledge Feedback Loop,Using usage data to improve knowledge content.,Knowledge Base & Self-Service,Knowledge-Feedback-Loop.md,completed,completed
Knowledge Gap,Missing information in knowledge resources.,Knowledge Base & Self-Service,Knowledge-Gap.md,completed,completed
Knowledge Management Strategy,Plan for organizing and sharing knowledge.,Knowledge Base & Self-Service,Knowledge-Management-Strategy.md,completed,completed
Knowledge Search,Finding information within knowledge systems.,Knowledge Base & Self-Service,Knowledge-Search.md,completed,completed
Knowledge Sharing,Distributing information across organization.,Knowledge Base & Self-Service,Knowledge-Sharing.md,completed,completed
Knowledge Transfer,Moving expertise between people or systems.,Knowledge Base & Self-Service,Knowledge-Transfer.md,completed,completed
Knowledge Worker,Employee whose main asset is expertise.,Knowledge Base & Self-Service,Knowledge-Worker.md,completed,completed
Organizational Knowledge,Collective information held by an organization.,Knowledge Base & Self-Service,Organizational-Knowledge.md,completed,completed
Self-Service Analytics,Tools letting users analyze data independently.,Knowledge Base & Self-Service,Self-Service-Analytics.md,completed,completed
Self-Service Portal,Platform for users to find answers independently.,Knowledge Base & Self-Service,Self-Service-Portal.md,completed,completed
Self-Service Ratio,Percentage of issues resolved without agent help.,Knowledge Base & Self-Service,Self-Service-Ratio.md,completed,completed
Self-Service Success Rate,How often self-service resolves user issues.,Knowledge Base & Self-Service,Self-Service-Success-Rate.md,completed,completed
Ticket Deflection,Reducing support tickets through self-service.,Knowledge Base & Self-Service,Ticket-Deflection.md,completed,completed
After-Call Work (ACW),Tasks agents complete after ending calls.,Knowledge Management Systems,After-Call-Work--ACW-.md,completed,completed
Article Feedback,User ratings and comments on knowledge content.,Knowledge Management Systems,Article-Feedback.md,completed,completed
Article Template,Pre-formatted structure for knowledge articles.,Knowledge Management Systems,Article-Template.md,completed,completed
Content Freshness,How recently knowledge content was updated.,Knowledge Management Systems,Content-Freshness.md,completed,completed
Decision Tree,Branching logic for guiding users to solutions.,Knowledge Management Systems,Decision-Tree.md,completed,completed
Knowledge Analytics,Metrics on knowledge content usage and effectiveness.,Knowledge Management Systems,Knowledge-Analytics.md,completed,completed
Knowledge Attribution,Linking solutions to source knowledge content.,Knowledge Management Systems,Knowledge-Attribution.md,completed,completed
Knowledge Centered Service (KCS),Methodology integrating knowledge into support workflow.,Knowledge Management Systems,Knowledge-Centered-Service--KCS-.md,completed,completed
Knowledge Hoarding,Keeping information instead of sharing it.,Knowledge Management Systems,Knowledge-Hoarding.md,completed,completed
Knowledge Maintenance,Regular updating and improving of content.,Knowledge Management Systems,Knowledge-Maintenance.md,completed,completed
Knowledge Management,Capturing and sharing organizational knowledge.,Knowledge Management Systems,Knowledge-Management.md,completed,completed
Knowledge Repository,Central storage for organizational knowledge.,Knowledge Management Systems,Knowledge-Repository.md,completed,completed
Knowledge Reuse,Using existing content to solve new problems.,Knowledge Management Systems,Knowledge-Reuse.md,completed,completed
Knowledge Silos,Information isolated within departments.,Knowledge Management Systems,Knowledge-Silos.md,completed,completed
Knowledge Workflow,Process for creating and updating content.,Knowledge Management Systems,Knowledge-Workflow.md,completed,completed
Search Analytics,Analyzing search behavior and results.,Knowledge Management Systems,Search-Analytics.md,completed,completed
Search Optimization,Improving findability of knowledge content.,Knowledge Management Systems,Search-Optimization.md,completed,completed
Search Relevance,How well search results match user intent.,Knowledge Management Systems,Search-Relevance.md,completed,completed
Semantic Search,Search using meaning rather than keywords.,Knowledge Management Systems,Semantic-Search.md,completed,completed
Subject Matter Expert (SME),Person with deep expertise in specific area.,Knowledge Management Systems,Subject-Matter-Expert--SME-.md,completed,completed
Topic Map,Visual organization of related knowledge topics.,Knowledge Management Systems,Topic-Map.md,completed,completed
Breadcrumb Navigation,Path showing user's location in site hierarchy.,Metadata & Taxonomy for Glossary Sites,Breadcrumb-Navigation.md,completed,completed
Canonical URL,Preferred URL for pages with similar content.,Metadata & Taxonomy for Glossary Sites,Canonical-URL.md,completed,completed
Content Tagging,Applying labels to content for organization.,Metadata & Taxonomy for Glossary Sites,Content-Tagging.md,completed,completed
Dublin Core,Standard metadata vocabulary for resources.,Metadata & Taxonomy for Glossary Sites,Dublin-Core.md,completed,completed
Faceted Navigation,Filtering content by multiple attributes.,Metadata & Taxonomy for Glossary Sites,Faceted-Navigation.md,completed,completed
Folksonomy,User-generated tagging system.,Metadata & Taxonomy for Glossary Sites,Folksonomy.md,completed,completed
Glossary Management,Creating and maintaining term definitions.,Metadata & Taxonomy for Glossary Sites,Glossary-Management.md,completed,completed
Hierarchical Taxonomy,Classification with parent-child relationships.,Metadata & Taxonomy for Glossary Sites,Hierarchical-Taxonomy.md,completed,completed
Indexing,Organizing content for efficient retrieval.,Metadata & Taxonomy for Glossary Sites,Indexing.md,completed,completed
Information Architecture (IA),Organizing and structuring content for usability.,Metadata & Taxonomy for Glossary Sites,Information-Architecture--IA-.md,completed,completed
Internal Linking Strategy,Plan for connecting related content.,Metadata & Taxonomy for Glossary Sites,Internal-Linking-Strategy.md,completed,completed
Keyword Mapping,Assigning target keywords to content pages.,Metadata & Taxonomy for Glossary Sites,Keyword-Mapping.md,completed,completed
Linked Data,Structured data connecting related information.,Metadata & Taxonomy for Glossary Sites,Linked-Data.md,completed,completed
Metadata Schema,Structured format for describing content.,Metadata & Taxonomy for Glossary Sites,Metadata-Schema.md,completed,completed
Ontology,Formal representation of knowledge relationships.,Metadata & Taxonomy for Glossary Sites,Ontology.md,completed,completed
Related Content,Suggestions for similar or complementary content.,Metadata & Taxonomy for Glossary Sites,Related-Content.md,completed,completed
Rich Snippets,Enhanced search results with structured data.,Metadata & Taxonomy for Glossary Sites,Rich-Snippets.md,completed,completed
Schema Markup,Code helping search engines understand content.,Metadata & Taxonomy for Glossary Sites,Schema-Markup.md,completed,completed
Semantic Markup,HTML that describes meaning of content.,Metadata & Taxonomy for Glossary Sites,Semantic-Markup.md,completed,completed
SEO Metadata,Title tags and descriptions for search optimization.,Metadata & Taxonomy for Glossary Sites,SEO-Metadata.md,completed,completed
Site Architecture,Overall structure and organization of website.,Metadata & Taxonomy for Glossary Sites,Site-Architecture.md,completed,completed
Site Navigation,Methods for users to move through website.,Metadata & Taxonomy for Glossary Sites,Site-Navigation.md,completed,completed
Tag Cloud,Visual display of popular tags.,Metadata & Taxonomy for Glossary Sites,Tag-Cloud.md,completed,completed
Taxonomy,System for classifying and organizing content.,Metadata & Taxonomy for Glossary Sites,Taxonomy.md,completed,completed
URL Structure,Format and organization of web addresses.,Metadata & Taxonomy for Glossary Sites,URL-Structure.md,completed,completed
Vocabulary Control,Managing consistent terminology usage.,Metadata & Taxonomy for Glossary Sites,Vocabulary-Control.md,completed,completed
Agent Desktop,Unified interface for support agent tools.,Omnichannel Support,Agent-Desktop.md,completed,completed
Blended Agent,Agent handling both inbound and outbound contacts.,Omnichannel Support,Blended-Agent.md,completed,completed
Channel Integration,Connecting multiple communication channels.,Omnichannel Support,Channel-Integration.md,completed,completed
Channel Optimization,Improving performance of support channels.,Omnichannel Support,Channel-Optimization.md,completed,completed
Channel Preference,Customer's preferred communication method.,Omnichannel Support,Channel-Preference.md,completed,completed
Channel Switching,Moving conversations between channels.,Omnichannel Support,Channel-Switching.md,completed,completed
Contact Reason,Category of why customers reach out.,Omnichannel Support,Contact-Reason.md,completed,completed
Context Preservation,Maintaining conversation history across channels.,Omnichannel Support,Context-Preservation.md,completed,completed
Conversation History,Record of past interactions with customer.,Omnichannel Support,Conversation-History.md,completed,completed
Customer Context,Information about customer during interactions.,Omnichannel Support,Customer-Context.md,completed,completed
Customer Intent,What customer is trying to accomplish.,Omnichannel Support,Customer-Intent.md,completed,completed
Customer Interaction Management,Managing all customer touchpoints.,Omnichannel Support,Customer-Interaction-Management.md,completed,completed
Customer Profile,Comprehensive view of customer information.,Omnichannel Support,Customer-Profile.md,completed,completed
Email Management,Organizing and responding to customer emails.,Omnichannel Support,Email-Management.md,completed,completed
Email Ticketing,Converting emails into trackable support tickets.,Omnichannel Support,Email-Ticketing.md,completed,completed
First Response Time (FRT),Time until first reply to customer inquiry.,Omnichannel Support,First-Response-Time--FRT-.md,completed,completed
Handle Time,Duration of customer service interactions.,Omnichannel Support,Handle-Time.md,completed,completed
In-App Messaging,Communication within mobile applications.,Omnichannel Support,In-App-Messaging.md,completed,completed
Intelligent Routing,AI-driven direction of contacts to best resource.,Omnichannel Support,Intelligent-Routing.md,completed,completed
Interaction Analytics,Analyzing customer conversations for insights.,Omnichannel Support,Interaction-Analytics.md,completed,completed
Live Chat,Real-time text conversation with support.,Omnichannel Support,Live-Chat.md,completed,completed
Messaging Apps,Communication through platforms like WhatsApp.,Omnichannel Support,Messaging-Apps.md,completed,completed
Multichannel vs Omnichannel,Difference between separate and integrated channels.,Omnichannel Support,Multichannel-vs-Omnichannel.md,completed,completed
Omnichannel Analytics,Metrics across all customer channels.,Omnichannel Support,Omnichannel-Analytics.md,completed,completed
Omnichannel Platform,Unified system for managing all channels.,Omnichannel Support,Omnichannel-Platform.md,completed,completed
Omnichannel Routing,Directing contacts across all channels.,Omnichannel Support,Omnichannel-Routing.md,completed,completed
Omnichannel Strategy,Plan for integrated customer experience.,Omnichannel Support,Omnichannel-Strategy.md,completed,completed
Queue Management,Organizing waiting contacts for service.,Omnichannel Support,Queue-Management.md,completed,completed
Resolution Time,How long it takes to solve customer issues.,Omnichannel Support,Resolution-Time.md,completed,completed
Response Time,Speed of replying to customer inquiries.,Omnichannel Support,Response-Time.md,completed,completed
Seamless Experience,Smooth transitions between channels.,Omnichannel Support,Seamless-Experience.md,completed,completed
Self-Service Options,Ways customers can help themselves.,Omnichannel Support,Self-Service-Options.md,completed,completed
SMS Support,Customer service via text messaging.,Omnichannel Support,SMS-Support.md,completed,completed
Social Customer Service,Support through social media platforms.,Omnichannel Support,Social-Customer-Service.md,completed,completed
Social Listening,Monitoring social media for brand mentions.,Omnichannel Support,Social-Listening.md,completed,completed
Social Media Integration,Connecting social platforms to support.,Omnichannel Support,Social-Media-Integration.md,completed,completed
Ticket Priority,Urgency level assigned to support tickets.,Omnichannel Support,Ticket-Priority.md,completed,completed
Ticket Routing,Directing tickets to appropriate agents.,Omnichannel Support,Ticket-Routing.md,completed,completed
Ticket Status,Current state of support ticket.,Omnichannel Support,Ticket-Status.md,completed,completed
Ticketing System,Software for tracking support requests.,Omnichannel Support,Ticketing-System.md,completed,pending
Unified Agent Experience,Consistent interface for all support channels.,Omnichannel Support,Unified-Agent-Experience.md,completed,completed
Unified Customer Profile,Single view of customer across channels.,Omnichannel Support,Unified-Customer-Profile.md,completed,completed
Unified Customer View,Complete picture of customer interactions.,Omnichannel Support,Unified-Customer-View.md,completed,completed
Unified Inbox,Single inbox for all communication channels.,Omnichannel Support,Unified-Inbox.md,completed,completed
Video Support,Customer service through video calls.,Omnichannel Support,Video-Support.md,completed,completed
Virtual Queue,Digital waiting line for customer service.,Omnichannel Support,Virtual-Queue.md,completed,completed
Wait Time,Duration customers spend waiting for service.,Omnichannel Support,Wait-Time.md,completed,completed
Warm Transfer,Transferring call with introduction to next agent.,Omnichannel Support,Warm-Transfer.md,completed,completed
Webchat Widget,Chat interface embedded on websites.,Omnichannel Support,Webchat-Widget.md,completed,completed
